Particulars,"March 31, 2022","March 31, 2021"
Not later than one year,"1,261.61","1,163.33"
Later than one year and not later than five years,"4,384.36","3,943.95"
Later than five years,"5,410.34","5,207.95"
Total,"11,056.31","10,315.23"
The total of minimum lease payments recognised in the Profit and Loss Account for the year,"1,347.58","1,390.04"
Total of future minimum sub-lease payments expected to be received under non- cancellable sub-leases,55.67,56.94
Sub-lease amounts recognised in the Profit and Loss Account for the year,10.85,9.92
Contingent (usage based) lease payments recognised in the Profit and Loss Account for the year,321.96,324.07
