Sr. No.,Name of the Shareholder,"No. of Shares
held","% to share
capital"
1,"JP Morgan Chase Bank, NA*","1,02,81,15,525",18.54
2,Housing Development Finance Corporation Limited,"86,46,15,834",15.59
3,HDFC Investments Limited,"30,00,00,000",5.41
4,LICI ASM NON PAR,"16,01,17,638",2.89
5,Europacific Growth Fund,"9,68,86,630",1.75
6,ICICI Prudential Bluechip Fund,"7,66,17,637",1.38
7,UTI-NIFTY Exchange Traded Fund,"6,32,56,598",1.14
8,HDFC Trustee Company Ltd. A/c. HDFC Top 100 Fund,"5,89,74,568",1.06
