Particulars,To Asset Reconstruction Companies (ARCs),To permitted transferees,To other transferees
Number of accounts,"70,921","65,704",-
Aggregate principal outstanding of loans transferred,"2,187.81",449.46,-
Weighted average residual tenor of the loans transferred (in years),3.01,2.01,-
Net book value of loans transferred (at the time of transfer),992.38,188.86,-
Aggregate consideration,"1,093.10",35.94,-
Additional consideration realised in respect of accounts transferred in earlier years,2.67,-,-
